"Full text of ""The Logic Of Liberty"" - Internet Archive",https://archive.org/stream/in.ernet.dli.2015.77543/2015.77543.The-Logic-Of-Liberty_djvu.txt
"Surrejoinder from Keenan, part 1.",https://www.informath.org/apprise/a5610/b0709/c0709121.txt
FCC-02-292A1.txt,https://docs.fcc.gov/public/attachments/FCC-02-292A1.txt
Auditor Independence: The Challenge of Fact and Appearance,https://www.sec.gov/news/speech/speecharchive/1996/spch114.txt
"EEOC v. Wal-Mart Stores, Inc.",https://www.eeoc.gov/sites/default/files/migrated_files/eeoc/litigation/briefs/walmart2.txt
The Critics of Keynesianism: A Survey - George Mason University,https://econfaculty.gmu.edu/bcaplan/keynes.txt
Sepulveda v. Salt River Pima-Maricopa Indian Community - EEOC,https://www.eeoc.gov/sites/default/files/migrated_files/eeoc/litigation/briefs/sepulveda.txt
Romances of the Archive. - Postmodern Culture,http://pmc.iath.virginia.edu/text-only/issue.902/13.1elias.txt
Full-Ride Engineering Scholarship - University of Michigan,http://websites.umich.edu/~aium/listserv/02_01_09.txt
https://princetonol.com/groups/phhh/original_site/...,https://princetonol.com/groups/phhh/original_site/archive/990.9.txt
