Exchange Agreement - SEC.gov,https://www.sec.gov/Archives/edgar/data/1340578/000095013705013709/c98052exv10w18.txt
The Peasant's Wise Daughter,https://www.cs.cmu.edu/~spok/grimmtmp/071.txt
Book of Wise Sayings Selected Largely from Eastern Sources,https://www.gutenberg.org/files/21130/21130-0.txt
WISE Catalog V1.0 - Table 2 (ionized gas velocities),http://astro.phys.wvu.edu/wise/Table2.txt
Wise family,http://files.usgwarchives.net/la/bienville/history/wisefam.txt
text-only version of this release - NASA,https://www.nasa.gov/home/hqnews/2010/oct/HQ_10-249_WISE_Image_Of_Comet.txt
Wise and Clifton Cemetery - USGenWeb Archives,http://files.usgwarchives.net/tx/hopkins/cemeteries/wise.txt
text-only version of this release - NASA,https://www.nasa.gov/home/hqnews/2012/apr/HQ_12-131_WISE_Aging_Star.txt
ftp://tgftp.nws.noaa.gov/data/zonecatalog.curr/txz...,ftp://tgftp.nws.noaa.gov/data/zonecatalog.curr/txz102.txt
