ardent/runtime.txt at master · neurodata/ardent - GitHub,https://github.com/neurodata/ardent/blob/master/runtime.txt
ex-21 subsidiaries of ardent health services llc - SEC.gov,https://www.sec.gov/Archives/edgar/data/1229505/000095014405009197/g95523exv21.txt
Ardent,https://members.tripod.com/~Data_Mate/irish/Ardent.txt
ex-21 subsidiaries of ardent health services llc - SEC.gov,https://www.sec.gov/Archives/edgar/data/1229505/000095014404003080/g88012exv21.txt
ARDENT HOSPICE & PALLIATIVE CARE SOUTHERN ILLINOIS ...,https://www.hipaaspace.com/medical_billing/coding/national_provider_identifier/codes/npi_1578332052.txt
"IBM Announcement Letter Number 187-051 dated April 2, 1987",https://ardent-tool.com/8580/187-051.txt
http://edgar.secdatabase.com/207/95014404008528/g9...,http://edgar.secdatabase.com/207/95014404008528/g90619exv99w1.txt
exercise-exercise-exercise order to account for the navy family ...,https://www.mynavyhr.navy.mil/Portals/55/Messages/NAVADMIN/NAV2016/NAV16131.txt
ARDENT COUNSELING AND CONSULTING PLLC | NPI ...,https://www.hipaaspace.com/medical_billing/coding/national_provider_identifier/codes/npi_1639814890.txt
Choice of the Vampire,https://www.choiceofgames.com/vampire/scenes/choicescript_stats.txt
