Camping - Word Search,https://www.free-word-search.com/words/activities/camping.txt
"Full text of ""Camping and woodcraft; a handbook for vacation ...",https://archive.org/stream/campingwoodcraft00kephrich/campingwoodcraft00kephrich_djvu.txt
66988-0.txt - Project Gutenberg,https://www.gutenberg.org/files/66988/66988-0.txt
"Full text of ""Organized camping and progressive education""",https://archive.org/stream/organizedcamping00wardrich/organizedcamping00wardrich_djvu.txt
Dorothy Dale's Camping Days - Project Gutenberg,https://www.gutenberg.org/files/16091/16091.txt
Family Camping Trip Ch 01.txt - ASSTR.org,https://asstr.xyz/files/Authors/ken/Family%2520Camping%2520Trip%2520Ch%252001.txt
Camping Trip By Joan - ASSTR.org,https://www.asstr.org/~Kristen/65/camping.txt
Text Responsive camping website.txt - GitHub,https://github.com/bedimcode/responsive-camping-website/blob/main/Text%2520Responsive%2520camping%2520website.txt
Statute of the regulation - Camping Bucaneve,https://www.campingbucaneve.eu/Doc/Statutoinglese.txt
Download Transcript - Petfinder,https://www.petfinder.com/static/32d62bda31be4e4a8cb5f9ba353dd1c9/n8m7d4.txt
