The Motto - The Original Hip-Hop (Rap) Lyrics Archive,http://ohhla.com/anonymous/method/prequel/themotto.mth.txt
Motto Less Than Jake Chords and Lyrics for Guitar,https://www.chordie.com/chord.pere/www.xguitar.com/guitar-tabs/less_than_jake/hello_rockview/motto.txt
The Motto - The Original Hip-Hop (Rap) Lyrics Archive,http://ohhla.com/anonymous/drake/takecare/motto.drk.txt
Anime Lyrics dot Com - Motto! - Magikano,https://www.animelyrics.com/anime/magikano/motto.txt
The Duke's Motto A Melodrama - Project Gutenberg,https://www.gutenberg.org/files/28266/28266-8.txt
ETFENG-34-version1.txt,https://web.etf.cuni.cz/ETFENG-34-version1.txt
Be a Friend to the Working Man,http://www.sscnet.ucla.edu/polisci/faculty/boneill/SongTexts/BeAFriendToTheWorkingMan.txt
Anime Lyrics dot Com - Shinken ni Motto - Put Your Heart Into It,https://www.animelyrics.com/anime/kor/shinkennimotto.txt
0001127602-13-018826.txt - SEC.gov,https://www.sec.gov/Archives/edgar/data/794172/0001127602-13-018826.txt
