"SerIal Killers... Mad, Bad, Dangerous",https://www.buffalo.edu/reporter/vol26/vol26n7/12.txt
Somebody Told Me The Killers Chords and Lyrics for Guitar - Chordie,https://www.chordie.com/chord.pere/www.xguitar.com/guitar-tabs/killers/hot_fuss/somebody_told_me.txt
Killers Iron Maiden Chords and Lyrics for Guitar - Chordie,https://www.chordie.com/chord.pere/chordiearchive.chordie.com/chord.pere/www.xguitar.com/guitar-tabs/iron_maiden/killers/killers.txt
ALL THESE THINGS THAT I'VE DONE KILLERS Guitar Song Chords,https://www.guitarsongs.info/the-killers/all-these-things-that-ive-done-the-killers.txt
"Full text of ""Serial Killers"" - Internet Archive",https://archive.org/stream/SerialKillersMichaelNewtonJohnL.French2008/Serial%2520Killers%252C%2520Michael%2520Newton%252C%2520John%2520L.%2520French%2520%25282008%2529_djvu.txt
SOMEBODY TOLD ME THE KILLERS - PJs Guitar Chords And Lyrics,https://www.guitarsongs.info/the-killers/somebody-told-me-the-killers.txt
had multiple prior arrest charges - Bureau of Justice Statistics,https://bjs.ojp.gov/content/pub/ascii/vfluc.txt
"Full text of ""Inside The Minds Of Serial Killers: Why They Kill""",https://archive.org/stream/InsideTheMindsOfSerialKillers--WhyTheyKillKatherineRamsland2006/Inside%2520the%2520Minds%2520of%2520Serial%2520Killers%25E2%2580%2594Why%2520They%2520Kill%252C%2520Katherine%2520Ramsland%2520%25282006%2529_djvu.txt
Legends & Killers Walkthrough - Super Cheats,https://www.supercheats.com/playstation3/walkthroughs/reddeadredemption-walkthrough03.txt
