Georgia Skeptic newsletter - Lysator,https://www.lysator.liu.se/skeptical/newsletters/Georgia_Skeptic/GS07-01.TXT
Symptoms of Pathological Skepticism,http://amasci.com/pathsk2.txt
"Skepticism Unrefuted: Strawson, Stroud and Other Minds",https://econfaculty.gmu.edu/bcaplan/strawson.txt
"Full text of ""THE BURDEN OF SKEPTICISM - CARL SAGAN""",https://archive.org/stream/TheBurdenOfSkepticism-CarlSagan/sagan-skeptism_djvu.txt
"Full text of ""Evenings with the skeptics; or, Free discussion on free ...",https://archive.org/stream/eveningswithske03owengoog/eveningswithske03owengoog_djvu.txt
The Superstitions of the Sceptic,http://www.gkc.org.uk/gkc/books/superstitions-of-the-sceptic.txt
A Journey Through the Land of Doubt and Back Again A Life Story,https://www.gutenberg.org/files/18675/18675-8.txt
457.txt - Loc,https://tile.loc.gov/storage-services/service/mss/mss85590/004/457.txt
http://ftp.se.freebsd.org/pub/skeptical/Newsletter...,http://ftp.se.freebsd.org/pub/skeptical/Newsletters/Georgia_Skeptic/GS05-03.TXT
Corporate Governance: Integrity in the Information Age - SEC.gov,https://www.sec.gov/news/speech/speecharchive/1998/spch206.txt
