draft-blind-bbs-signatures.txt - Decentralized Identity Foundation,https://identity.foundation/bbs-signature/draft-blind-bbs-signatures.txt
American Council of the Blind - Federal Communications Commission,https://transition.fcc.gov/Bureaus/Wireless/Comments/fcc98055/acb.txt
tabs/Elder/Reflections/04 Blind.txt at master · doomsean/tabs - GitHub,https://github.com/doomsean/tabs/blob/master/Elder/Reflections/04%2520Blind.txt
"Full text of ""Combined book of sash, doors, blinds, mouldings, stair ...",https://archive.org/stream/PaineLumberCo.CCA39652/Paine%2520Lumber%2520Co.%2520%2520CCA%252039652_djvu.txt
The Light That Blinds Shadows Fall Chords and Lyrics for Guitar,https://www.chordie.com/chord.pere/www.xguitar.com/guitar-tabs/shadows_fall/war_within/the_light_that_blinds.txt
Blind Talking Heads Chords and Lyrics for Guitar - Chordie,https://www.chordie.com/chord.pere/chordiearchive.chordie.com/chord.pere/www.pjandphil.utvinternet.com/heads/blind.txt
Video Transcript - National Center on Deaf-Blindness,https://www.nationaldb.org/media/Children_Who_Are_Deaf-Blind.txt
Julee-Anne Bell | World Access for the Blind,https://waftb.net/sites/default/files/juleeanneb.txt
Text - Mississippi Department of Rehabilitation Services - | MS.GOV,https://www.mdrs.ms.gov/sites/default/files/mdrs/Brochures/VRB_text.txt
