Coastal waters from Bonita Beach to Englewood FL out 20 NM,https://tgftp.nws.noaa.gov/data/forecasts/marine/coastal/gm/gmz856.txt
Manual Subreflector Chopping,https://aro.as.arizona.edu/~tfolkers/old_smt_docs/trychop.txt
Waters from Apalachicola to Mexico Beach FL from 20 to 60 NM,https://tgftp.nws.noaa.gov/data/forecasts/marine/coastal/gm/gmz750.txt
source,https://perldoc.perl.org/functions/chop.txt
Checking and Setting the Wobbler Frequency and Blanking Time,https://aro.as.arizona.edu/~tfolkers/old_smt_docs/wobble_cal.txt
Pork Chops With Paprika in Cream Sauce.txt,http://www.dansdigs.com/Recipes-Untried/Pork%2520Chops%2520With%2520Paprika%2520in%2520Cream%2520Sauce.txt
Karate Chop (Remix) - The Original Hip-Hop (Rap) Lyrics Archive,https://ohhla.com/anonymous/riffraff/rm_bside/kchoprmx.rif.txt
An overview of COMICS data structure,https://www.naoj.org/Observing/Instruments/COMICS/canadia-mirror/comics/open/iraf-script/comics-data-struct.txt
North Carolina Pasture Raised Pork Report (Monthly),https://www.ams.usda.gov/mnreports/ra_lo103.txt
North Carolina Pasture Raised Lamb Report (Monthly),https://www.ams.usda.gov/mnreports/ra_lo102.txt
